song_id,Song,Genre,Song_notes,religious_manual,dance_manual,mourning_manual,healing_manual,lullaby_manual
1889,Hosannah,NA,NA,0,0,0,0,0
3636,Aleeyui,Improvised Song,"Songs with words improvised to suit the occasion, the new words are sung by one singer and repeated by the whole assembly, recorded at Sapong Rubber Estate",0,0,0,0,0
2728,Courting Song,NA,"Courting ceremonies and songs often directly follow funerary rites, the large community events are inherently well-chaperoned and serve as ideal meeting places for young people from different villages",0,0,0,0,0
2174,Haikaiky,Feast Song,Solo genre for a status feast,0,0,0,0,0
1915,Waitoito,Boys' Song,"Boys' song, accompanied by a percussion troupe with beaters",0,0,0,0,0
363,Women's Song 1,Women's Song,Women's song,0,0,0,0,0
9398,Macedonske Horo,Dance Song,"Dance song, Horo of the Pirin Mountains, played by two Muslim Roma, slow promenade and gradual acceleration",0,1,0,0,0
2652,Aakin Kuukn Kotush,Dance Song,"Dance tune, mother's daughter Kotush",0,1,0,0,0
1285,"Long Time Ago, Caesar Boy",Boat Song; Work Song; Sailor's Song; Funeral Song; Hauling Song,"Work songs related to the sea are found in most parts of the Caribbean. Although many songs in this category have an African flavor, others clearly draw on European traditions. The British Caribbean in particular is known as a rich repository for old sea chanteys. This launching song from Carriacou appears to be derived in part from one such chantey, known to collectors as “A Long Time Ago” or “In ’Frisco Bay.” This chantey, which was very popular on English and American ships during the nineteenth century, was originally a halyard song, used for hoisting or lowering sails. In Carriacou, however, it is used for very different purposes, such as launching schooners or honoring deceased sailors at wakes. 

Whereas many versions of “A Long Time Ago” make mention of ’Frisco Bay, this one refers to “Mobile Bay,” which would seem to lend support to those who have argued that West Indian workers and sailors played a major role in the development of British and American chanteying. (Mobile, Alabama, was an important cotton-trading center and one of the bustling American seaports where West Indian sailors and those from other nations met, caroused, and exchanged songs during the nineteenth and early twentieth centuries.) Although the singing style of the launching song heard here resembles that of British or American chanteymen, Carriacouan sailors use the song to honor the spirits of deceased friends and relatives, thus investing it with a new meaning that faithfully reflects the religious concepts of their African ancestors.",0,0,0,0,0
3620,"Turn, Julie-Ann Turn",Courtship Song,Courting and play song performed by Jean with dulcimer accompaniment,0,0,0,0,0
9735,Chant de Sarclage 2,NA,Weeding song,0,0,0,0,0
2690,Mgongole Molimoli,Wedding Song; Dance Song; Ceremonial Song,Kuduo dance song for wedding ceremony,0,1,0,0,0
9948,Guardian Spirit Song,Spirit Song,NA,1,0,0,0,0
9621,Ratok Solok,Lagu Asal; Place Of Origin Song; Ratok; Lament,"Lagu asal, song of place of origin, ratok, lament, text: Hoping the moon would shine brightly, the oil lamp was put out",0,0,1,0,0
30018,Muheme 1,Wedding Song,Wedding songs,0,0,0,0,0
30033,Nshoz' Uruyange,Praise Song; War Song,"A praise song related to war, basically leader/chorus but with other voices interweaving in background",0,0,0,0,0
194,Warrior's Dance,Dance Song; Warrior's Song,Warrior's dance song,0,1,0,0,0
30344,Invitation to Work,NA,Leader appears only on first phrase,0,0,0,0,0
9337,Girl's Song,NA,"Song pays respect to dignitaries in the audience, would be normally accompanied by a can",0,0,0,0,0
283,Nyamugowelo,Work Song; Comic Song; Pounding Song,"Humorous song with guitar, composed by Muntano Gomez",0,0,0,0,0
4293,Ashug,NA,Ashug (ashik),0,0,0,0,0
2848,Argagui Amrag,Bogino Duu,"Bogino duu (short song), My Darling",0,0,0,0,0
1056,We All Goin' Ashore,Chantey,"Chanty, in English",0,0,0,0,0
578,M'y Promenant Le Long De Ces Verts Près,Ballad,"Florentine Chaloni, the wife of a Saint-Nazaire ship- yard worker, lived in Brière, part of the Gallo- speak- ing area of Brittany. Gallo is a Romance language with some words from Breton. This French ballad, M'y Promenant Le Long De Ces Verts Près (While Strolling Across These Green Meadows), known throughout France and Canada, tells of the abduction of a lady by a sailor.",0,0,0,0,0
2707,Thai Mixed Chorus 1,NA,NA,0,0,0,0,0
1445,"Roll, Roll, Roll and Go",Wake Song; Chantey; Fisherman's Song,Chanty for a fisherman's wake,0,0,1,0,0
9089,Yamala iye,Work Song,Repetitive alternation between women scraping sago,0,0,0,0,0
9416,Poniky,NA,NA,0,0,0,0,0
92,Hotumolo,Fisherman's Song; Spirit Song; Fishing Song,Fishermen's song performed to the spirits of the sea to drive fish towards the boats,1,0,0,0,0
3134,Onio,NA,Nuptial song,0,0,0,0,0
3933,Taliel,Elders' Song,Elderly female soloist unaccompanied,0,0,0,0,0
3398,Wedding Song,NA,NA,0,0,0,0,0
30275,Maghiiti by Tekehu,Ritual Song; Fertility Song,"Ritual song, asking Tehu'aingabenga, the god of the district, to supply children",1,0,0,0,0
2428,Seaman's Song,Work Song; Sailor's Song,Occupational song,0,0,0,0,0
4272,"Tres ejemplos de la Tribu Orejon, g&h",Breathless Song,Breathless song accompanied by insistent drumming,0,0,0,0,0
324,Political Song 1; Talking in English,Political Song,Political song,0,0,0,0,0
9562,Call to the Forest; Call for the Daughters,Forest Song; Calls; Cries; Women's Song,"Nighttime cries of a woman to her sister, atmospheric",0,0,0,0,0
9954,Kiriwina Island Rubato Song,Women's Song,"Traditional Kiriwina Island song, female lead over female chorus in unison, with occasional overlapping humming or interludes of hummed polyphony",0,0,0,0,0
9473,Poor Ellen Smith,Murder Ballad; Ballad,"This American ballad was based on an event that took place in 1893 in Mt. Airy, North Carolina, where a man named Peter de Graff was convicted of murdering his sweetheart Ellen Smith, and was said to have composed this song in prison while awaiting his execution. Frank C. Brown, in his collection North Carolina Folklore, reports a version twelve stanzas long, dating from 1911. A. K. Davis lists six texts in Traditional Ballads of Virginia. Henry Whitter made a commercial record of the song in the late 1920s, and Molly O’Day recorded it with five-string banjo for Columbia in the late 1940s. The Country Gentlemen made a hot bluegrass arrangement of it in 1960; it is still a standard in the bluegrass repertoire today.",0,0,0,0,0
2378,E-E-Ama,Dance Song,Multi-song dance,0,1,0,0,0
4453,Faja ston,Girls' Song,NA,0,0,0,0,0
2852,It Was All Dark in the Beginning,Festival Song; Creation Song,"Festival song about the origin of the world, choral antiphony with soloist, lyrics: It was all dark in the beginning",1,0,0,0,0
4154,Otlargopa,NA,"Epic song by the Ensemble of Folk Song and Dance of the Abkhaz Republic, conducted by Mr. Gumba",0,0,0,0,0
9013,"The Moon Is Rising, the Moonlight Is Yellow",NA,"Female and male duet, unaccompanied, recorded at National Folksingers Festival",0,0,0,0,0
3810,Amma Amava,NA,NA,0,0,0,0,0
991,Suratu 'r-Rahman,NA,"The Chapter of the All-Merciful, Qoran Ch. 15 vv. 1-16",1,0,0,0,0
3761,Pearl Diver's Prayer,NA,"Prayer, sung as the pearl divers enter boat",1,0,0,0,0
30636,Gwas macumine,Narrative Song; Love Song,"Macumine song, two phrase litany. This song praises an Atayal couple who could not be together and commit suicide in Heaven Lake around Macumine Mountain.",0,0,0,0,0
3618,The Ship Carpenter,Ballad; Magic Song,"A child ballad, part of a collection telling a connected story. The ship is magical and run by some dark power.",0,0,0,0,0
9919,Bhajan,Devotional Song; Bhajan,Devotional song,1,0,0,0,0
468,Wasn't That a Mighty Storm,Religious Song; Historical Song,"In structure and style this song about the Galveston tidal wave is in the tradition of ballads about disasters, such as the more familiar ""Sinking of the Titanic."" At the same time it has the religious setting and flavor of a song sermon on death, as Sin~Killer Griffin and his con­gregation point up the awfulness of physical destruction, with implied spiritual symbolism.",0,0,0,0,0
3863,Kamayurá Song 3,NA,NA,0,0,0,0,0
30066,Capellai,Women's Song,"A women's song, sung softly and with laughter. As the song progresses, a male voice interjects.",0,0,0,0,0
9952,Buita,Dance Song; Village Song,"Traditional Kapwani village song, dance song, male lead over male chorus in unison, with occasional overlapping humming or interludes of hummed polyphony, which begins a new thematic idea or invites a new lead, litany",0,1,0,0,0
1440,When We Step out on the Road,Carnaval Music,"This recording was made at a critical time in the history of Carnival and calypso in Grenada, when older forms were being supplanted by newer traditions imported from Trinidad. Up to the late 1950s, Grenada was home to a distinctive, local Afro-Caribbean Carnival based on folk traditions and costumed characters of its own, such as Shortknee and Pierrot Grenade (some of which had earlier influenced the Carnival of Trinidad). Well-known local calypso singers such as Papa Edmund and Lord Roamer usually performed with village string bands featuring some combination of banjo, guitar, cuatro, and chorus singers. These calypsonians were still known, as elsewhere in the French-influenced Caribbean, as “chantwells.” In the late 1950s, the Grenadian chantwells Lord Melody (a different individual from the better-known Lord Melody of Trinidad) and Quo Vadis introduced organized calypso tents and formal competitions based on the Trinidadian model. Calypso in Grenada, as in the other Anglophone islands, soon came to be dominated by the sounds emanating from Trinidad, a trend that continues today. The older string-band sound heard in this selection has almost disappeared from Carnival in Grenada, having long ago been displaced by the more “modern” strains of steel band and soca music. The lyrics of the song reflect the subversive spirit of Carnival, humorously overturning the norms of “proper” everyday social life; temporarily freed from normal constraints, the “saga gals” (fancy, showy, dressed-up girls) leave their watchful mothers at home and venture out on their own to take over the town.",0,1,0,0,0
30340,Song for Healing and Expelling Evil,NA,Spoken introduction,0,0,0,1,0
142,Ceremonial Chant,Ceremonial Song; Chant,Ceremonial chant,0,0,0,0,0
2092,Danse Du Kananga,Dance Song; Mask Dance,Kananga dance,0,1,0,0,0
815,Trugnal Mi Yane Sandanski,Ballad,"One of many ballads in honor of Macedonian revolutionary leader Yane Sananski, sung by a girl from his home village",0,0,0,0,0
1837,Trance song 2,Trance Song,"Trance song, polyphonic with vocal ostinatos",1,0,0,0,0
3241,Ramkokomekrá 2,Social Dance; Dance Song; Animal Song,"Fish festival dance, tick song, daily afternoon social dance done for fish festival, collected fish society songs of the west side of the plaza",0,1,0,0,0
1221,Hawk Song,Animal Song; Manikay,Song describes a white sea hawk swooping down from the clouds looking for food,0,0,0,0,0
30669,Oksn,Children's Song; Cumulative Song,"Oxen, cumulative children's nonsense song, lyrics reflect daily household activities and life in 19th century Eastern Europe",0,0,0,0,0
817,Dragano Draganke,Wedding Song,"A bridesmaid's song, sung to the bride at the moment when the bridegroom's party arrives to take her to church, subject of song refers to ancient custom of marriage by capture",0,0,0,0,0
9779,Chu Hai Diao Yu Ge,NA,Sea fishing song,0,0,0,0,0
4009,Morning Song,Morning Song,"Morning song, quickly paced vocal line and bowed fiddle",0,0,0,0,0
658,Bentara Noa,"Artaxuriketa -corn-shucking song, group work song",First of three short songs sung at this session by young girls while gathering  for a corn shucking bee.,0,0,0,0,0
3768,Kelwa Geet Songs,Girls' Song,Girls' song,0,0,0,0,0
3255,Aguinaldo Jibaro,Aguinaldo; Christmas Song; Carol,"Typical Christmas Carol music, telling the story of the Nativity, the Birth of Christ, Hibaro refers to the Puerto Rican aboriginals",0,0,0,0,0
760,Folk Song,Work Song; Boat Song; Rowing Song; Hauling Song; Agricultural Song,"A work song popular among laborers working in the tea gardens, rowing boats, or other heavy work.",0,0,0,0,0
575,Lieve Schipper Vear Mi Jover,Ballad; Sailor's Song,"Dear Skipper Sail Me, long ballad, two stanzas, 'Dear Sailor, do take me across/ to yonder village/ Then I will give you a necklace/ And a precious stone/ Sweetheart, I won't take you across/ Not for a necklace, not for a stone/ For such trifles/ I am not inclined to carry you to the other shore', mixed unison chorus",0,0,0,0,0
2620,Gilbert Song 5,NA,NA,0,0,0,0,0
2626,Tanger Tarmal Falalop,Love Song; Boat Song,"A love song sung on a canoe, with the sound of rain in the background.",0,0,0,0,0
2421,Jhyaure,Love Song; Lament,Song about a man leaving his beloved,0,0,0,0,0
2905,Male Vocal,NA,Male soloist with stomping and oud,0,0,0,0,0
4193,Amba Dance Song,Dance Song,Dance song,0,1,0,0,0
9221,J'avais une maîtresse,Ballad,"The Cotentin peninsula in Normandy is inhabited by seafaring people who sailed for Newfoundland from Granville (as well as from Dieppe and Fécamp in Upper Normandy, and from Saint-Malo and Cancale in Brittany), and hence were singers of the chanteys and sea songs of the Terre-Neuvas.

This ballad, J'avais une maîtresse (I Had a Fiancée), recounts the tale of a soldier’s unexpected arrival home after seven years in the army, only to find his wife about to take a new husband. The French composer Darius Milhaud  (1892–1975) wrote a short opera, Le Pauvre Matelot (1926), based on a similar version of this story, with a libretto by Jean Cocteau.",0,0,0,0,0
3431,Yeminja 1,NA,Yoruba females,0,0,0,0,0
3760,Raising Anchor,NA,Pearl divers' rowing song for when there is no wind,0,0,0,0,0
4289,Siurmeli Kyz,NA,"Folk song, with tar, nai, rebab",0,0,0,0,0
30207,Limbung Dance,Ceremonial Song; Dance Song,"Part of the Malangan ceremony, continuous vocalizing",0,1,0,0,0
743,"Atan, War Dance (Faster)",War Dance Song; Circle Dance,"Wardak tribal dance, performed in a circle",0,1,0,0,0
506,Hunedoara chanson,NA,NA,0,0,0,0,0
9355,O Death,Spiritual; Religious Song,"A spiritual, the lyrics concern a dialogue between Death and the reluctant sinner",1,0,0,0,0
737,Besta,NA,Folk song,0,0,0,0,0
2980,Male Solo,Men's Song,Male voice in a short strophic song,0,0,0,0,0
2513,Cattle Calls,Work Song; Cattle Song; Mountain Song; Pastoral Song,"Very old cattle calls used in the Norwegian mountains, characteristic melisma episodes reminiscent of the Kyrie and Hallelujah melodies during the five centuries during which Norway was affiliated with the Church of Rome",0,0,0,0,0
9803,Munggona dit,NA,NA,0,0,0,0,0
9192,Notched Flute,Instrumental,"Notched flute, played by Weser Whaleboat, this is the only flute melody now heard in eastern Torres Strait",0,0,0,0,0
1637,Das Letzte Gericht,Religious Song; Dialogue Song,Religious dialogue song between sinner and his Judge at the Last Judgment,1,0,0,0,0
116,"Meke, About Setura",NA,NA,0,0,0,0,0
3966,Fa Leicuta,Doina,Doină,0,0,0,0,0
3039,Ce Moin Ayida,Dance Song; Religious Song; Cult Song; Supplication Song; Spirit Song; Song For Deity,"Zepaule dance, religious music for Dahomey family of Vodoun rites, used to supplicate loa Ayida Wedo (spirit being)",1,1,0,0,0
2411,Shendamundale banana,Lament,"I Am a Very Worried Man, Lament song",0,0,1,0,0
3716,Female Solo,NA,"Female soloist singing, wavering delivery, nasal tone",0,0,0,0,0
3325,Baruun Shugy Shuuiaatai,Comic Song; Wedding Song,"Comic wedding song, The West Pine Forest Is Humming, The Wind Is Blowing in the Bushes",0,0,0,0,0
2760,Men's Drinking Song,Drinking Song; Men's Song; Song Of Friendship,"Words signify asking for more Chicha and reminding each other of friendship, Yakono wapse: in order to be a friend",0,0,0,0,0
1386,"Oh Boy, Le' We Pull De Wood",Bongo Song; Work Song,"An English Creole Bongo song, also used as a work song.",0,0,0,0,0
624,Coro greco,NA,"The solemn polyphonic litanies are peculiar to this region, in which a leader ""lines out"" and is joined by a chorus.",0,0,0,0,0
3719,Men's Song 1,Men's Song; Responsorial Song,Call and response between group of men and solo male,0,0,0,0,0
9877,"Kajali, Kajari",Monsoon Song,"Monsoon song, mixed chorus over sparse percussion",0,0,0,0,0
9476,Rosewood Casket,Popular Song,A popular song from the Mauve Decade that fixed itself in the folk repertoire of the South.,0,0,0,0,0
2565,Lullabies,Lullaby,"A lullaby in which the mother's hand slapping against the baby is audible. (Robert Ritzenthaler and Pat Ritzenthaler, Music of the Cameroons, Ethnic Folkways Library, Album No. FE 4372, 1959)",0,0,0,0,1
2097,Somagwaza,Praise Song; Chief's Song; Song About Leadership,"Praise song thanking the Chief for having killed a beast, Father of the Stabbing, Mpondo mixed group",0,0,0,0,0
2898,La Passion De Jesus Christ,Passion Of  Christ; Canticle,"Canticle for Good Friday, The Passion of Christ",1,0,0,0,0
184,Prisoner's Song,Prison Song,"Prisoner's song

The composer of this song was hanged for murder in an Edmonton jail several years ago. A few of his friends who visited him in jail still remember the sad song he sang there, but all agree that the present singer sings it best. Perhaps the fact that he is blind gives him special feeling for the mood of disillusionment which surrounds both the melody and words. While songs of this sort are not common, they do express the Indian's disillusionment not only with his own traditional values but with all the superficial trappings of modern civilization, both material and spiritual.",0,0,0,0,0
957,Aroro,War Song,Song describing a massacre of an enemy village,0,0,0,0,0
438,Narrative Song,Narrative Song,Narrative song from the kraal,0,0,0,0,0
9493,Mari Stoyane Stoyane,Spring Song; Door Todoor Singing,"On the day before Palm Sunday, girls dressed in plumed headgear go from house to house round the village, to sing in the Spring and to bring luck",0,0,0,0,0
30634,Song of Praising a Beautiful Woman,Daily-Life Song,"The whole song has ""rimuy su na rimuy yo"" (""You are truly beautiful! Truly beautiful!"") as the central element, praising the girls of the Atayal tribe.",0,0,0,0,0
30089,Kivaleo,Game Song; Work Song; Yodel,"Yodeled chant duet, Vocal games are often played while doing chores such as collecting firewood",0,0,0,0,0
1881,War Clan Song 1,War Song; Clan Song,"Song of the War Clans of the Plains Indians, dances conducted before and after battle",0,0,0,0,0
4160,Mean Old Bed Bug Blues,Blues,"Slow blues, Smith's iconic commanding voice, much like Ma Rainey's, cuts through the rhythmic accompaniment of guitar and piano",0,0,0,0,0
1831,Corn Festival Song,Corn Song; Festival Song; Responsorial Song,"Corn festival song, call and response with no overlap",0,0,0,0,0
255,Mai-O-Da,Fishing Song; Women's Song,"A women's song, sung after fishing. Three women sing a litany in unison, with occasional harmony.",0,0,0,0,0
3377,Tarukachus Mamay Karan,Carnaval Music,Carnaval de Chumbivilcas,0,1,0,0,0
30488,Ifugao Song 2,NA,Mixed group sings with secundal dissonance,0,0,0,0,0
3217,Dua,Prayer,"A Prayer, Mashairi sung poem, Kaluta Amri Bin Abedi, composer",1,0,0,0,0
9332,Glenlogie,Ballad,"The gay, nimble-footed, and noble Gordon family feature in many North East ballads. Here, Jeannie falls so hard for a distant relative that she is dying. Her family is too poor for Glenlogie to consider it appropriate to marry into, but a fine letter composed by her father saves her. Present-day singers prefer Glenlogie to reject Jeannie for the kinder reason of a prior engagement: “I thank ye, Jeannie Gordon, but I’m promised awa,” as sung by John Adams on his The Muckle Sangs (Greentrax) album.",0,0,0,0,0
9268,Ethiopian Style,NA,"Solo male song with melismatic embellishments. An old, highly cultivated manner in which the tone is choked, stopped at the throat. There is a rapid vibrato, suggesting some Occidental influence, but there are many Oriental decorations, single and double trills in 1/2, whole and one and 1/2 steps, sometimes resolving into a single tone again. (Henry Cowell, The World's Vocal Arts, Ethnic Folkways Library, Album No. FE 4510, 1955)",0,0,0,0,0
9888,Narrative Song,Narrative Song,NA,0,0,0,0,0
30244,Lengbu,NA,NA,0,0,0,0,0
4456,Song of Welcome,Welcome Song,Song of welcome,0,0,0,0,0
1135,"Libèro, Libèro",Story Song,"Story song, French Creole",0,0,0,0,0
1280,Demba-o,Story Song,Story song in Kréyol,0,0,0,0,0
1537,Kumarmyn,NA,"Common Kyrgyzstan song form with alternation between male vocal soloist and komuz, melodic line is long and flowing with crescendos and sustained pitches, komuz rhythm is driven with a galloping feel",0,0,0,0,0
4252,Village Dance Song,Dance Song,NA,0,1,0,0,0
20458,Extravagancia,Men's Song,Male duo over tambourine,0,0,0,0,0
4452,Prefoe mi teki wan kaartaman,NA,NA,0,0,0,0,0
2490,"Stick Game Song, Part 2",Gambling Song; Game Song; Stick Game Song; Hand Game Song,Gambling stick and hand game song,0,0,0,0,0
9596,Buzubuzu,Sitting Dance; Dance Song; Interlock,"Sitting dance, male-female duet over mixed chorus and shaker, male duet full of interlock, entrances of chorus are marked by low vocal drone and followed by reply from female duet in high register",0,1,0,0,0
30181,Elephant Song,Animal Song,"Sung by male leader over unison chorus, with lots of chattering calls.",0,0,0,0,0
3178,Festival Music of the Royal Court,Court Music,"Court music, melody of King Kaira Bari, performed by Guinea griots",0,0,0,0,0
2716,Male Solo with Can,NA,"Maulam Lao, repartee singing, the reed mouth organ, can, is also used to accompany repartee singing",0,0,0,0,0
30409,卑南慶祝豐收歌,Ritual Song; Calendrical Rite,"Celebrating The Harvest Song, Females chorus, accompanied by rattles",1,0,0,0,0
2825,"Amuri, Amuri 'N Suonnu Mi Vinisti",Serenade,"Serenade with guitar played in pizzicatella style by immigrants from Reggio Calabria, in New York City area,",0,0,0,0,0
650,O Conde Ninho,Harvest Song; Ballad; Work Song; Agricultural Song,"The Count Ninho, the widely spread ballad of Conde Ninho has here a functional role as a harvest song",0,0,0,0,0
2221,Butterfly Dance,Social Dance; Dance Song; Animal Song,In the Pueblo Tribe (of which the Lagunas are a part) the Butterfly Dance is a social dance celebrating the coming of spring and asking for rain,1,1,0,0,0
3874,Song from Lake Sentani,Lake Song,NA,0,0,0,0,0
1703,Garter Dance,Social Dance; Dance Song,Social dance,0,1,0,0,0
4419,Tangi,NA,"Sung by a female lead with expressive, tense delivery, over a small group of women who enter and exit occasionally.",0,0,0,0,0
9377,Nous Sommes Venus Vous Vouer,Wedding Song,Wedding song for the bride,0,0,0,0,0
9250,"Fight on, the American Bullies",Chantey; Work Song,"Chantey, work song, Recorded at Women's League, Methodist Church",0,0,0,0,0
9864,"Zora, Eh Zorica",Dance Song,Dance song with nonsense lyrics,0,1,0,0,0
4237,Wedding song,Wedding Song,Wedding song,0,0,0,0,0
1948,Hausa Begging Song,Begging Song,"Hausa blind man singing his begging song, which he sings in front of people's houses while he waits for them to give money to him.",0,0,0,0,0
30210,Initiation Song 1,Initiation Rite,Male singing falsetto,1,0,0,0,0
30663,Ibaloi Song 8,NA,Sounds like mixed group with male leader (VG),0,0,0,0,0
4410,Porter's Song,Work Song; Hauling Song,NA,0,0,0,0,0
9494,Necu Vise Sprolazit Skroz Selo,Epic Song; Bugarenje,"Epic folk song, bugarenje, in which text is more important than melody",0,0,0,0,0
1999,Traveling Song,Traveling Song,"Female leader with female chorus, possibly includes children",0,0,0,0,0
4213,Hajjin Praise Song,NA,Praise song,0,0,0,0,0
1336,Thumrī,Thumrī; Tan-Singing,"Thumrī, tan-singing, the term 'thumri' is derived from the Hindi verb thumakna meaning 'to walk with dancing steps so as to make the ankle-bells tinkle', connected with dance, dramatic gestures, mild eroticism, evocative love poetry, and folk songs.

Despite a general lack of exposure to North Indian classical music, generations of Indo-Caribbean musicians, drawing on their fragmentary knowledge and their own innovative spirit, cultivated a “local classical” genre that came to be known as tan singing. Sung at weddings and other functions, tan singing evolved into a unique idiom, with thoroughly idiosyncratic versions of North Indian classical and semiclassical genres like dhrupad, ghazal, and especially thumri, heard here. 

Trinidadian thumri bears little resemblance to its North Indian counterpart: it is distinguished primarily by its sequential rhythmic structure. This includes a curious metrical modulation during the initial sections, in which the downbeat shifts by one beat between the refrain and verse passages, before accelerating in an extendedbarhti  (in India, laggi ) section. As is standard, the singer here doubles his vocal line on harmonium, while being accompanied by dholak and dantal, a steel rod struck with a U-shaped clapper. Although in severe decline in Guyana and Suriname, tan singing is still relatively vital in Trinidad.

The text to this song, as in most tan singing, is drawn from published verse anthologies obtained from India. This verse contains the pen name of the mystical poet Kabir (1440—1518), perhaps a misattribution.",0,1,0,0,0
3527,Male Chorus with String Ensemble,NA,Male Chorus with String Ensemble,0,0,0,0,0
2527,Religious Song,Religious Song; Responsorial Song,"Call and respoonse religious song, performed by a male soloist with male chorus",1,0,0,0,0
30421,Welcome and Farewell Song,Daily-Life Song,NA,0,0,0,0,0
446,Song About the Origin of the Royal Clan,Court Music; Historical Song; Song About Leadership,Court song,0,0,0,0,0
2693,Lipwani Lyaliswangawantu,Work Song; Agricultural Song,Agricultural work song,0,0,0,0,0
