song_id,Song,Genre,Song_notes,religious_manual,dance_manual,mourning_manual,healing_manual,lullaby_manual
9387,Tailaff,Love Song,Love song by a male soloist accompanied by a virtuosic female Inzad (one string fiddle) player,0,0,0,0,0
9422,Harvest Song,Harvest Song; Agricultural Song,A polyphonic song about harvest processes. Men produce a rhythmic accompaniment by beating their shields with their spears.,0,0,0,0,0
3070,Lullaby,Lullaby,"Lullaby, female soloist unaccompanied, in relaxed voice",0,0,0,0,1
1187,Abraham Soulagé-mwen,Bélé; Bélé Bidjin; Biguine; Spirit Song; Healing Song,"Beguine bélè invoking a spiritual messenger between humans and God for people in distress, pain, or illness",1,0,0,1,0
2138,Ikokole,Dance Song,Dance song with slit drum,0,1,0,0,0
30665,Nakemo,War Song; Ritual Song,"Two male soloists with mixed group. Tsou song used in war ritual. The singing style of this song is similar to that in Tapangu; the only difference is the pronunciation of ""ke"" in ""nakemo.""",1,0,0,0,0
1237,The Warrior's Stomp Dance,Dance Song; Stomp Dance,"Seneca-Onondaga trotting dance, excerpt",0,1,0,0,0
1687,Mzeno of Komukomu,Dance Song; Mzeno,"Orchestral dance, Kapani waChikwita, composer",0,1,0,0,0
9702,Song for Men's Voices in Front of the Cosmological Tree,NA,"Ritual song near the Cosmological Tree, which plays a central role in shamanic culture",1,0,0,0,0
20481,Danabala,Story Song; Ballad,"Story song, ballad singing",0,0,0,0,0
1392,Ai Landay La Dayway,Shango Song; Dance Song,Shango - music and dance for the orisha (fire diety).,1,1,0,0,0
2199,Aloou Koun (Discours de Semassoussi),Song For Royalty; Vocal Imitation Of Instrument,"Chorus of princes, vocal imitation of trumpet technique performed by descendants of the royal family",0,0,0,0,0
3311,Male Chorus with Drum,NA,NA,0,0,0,0,0
9198,Ciocârlia,Animal Song; Concert Piece; Orchestra,"During the Communist years (1944–1989), large, concert-style folk orchestras came into being in the capital and various provincial towns and cities. These orchestras, modeled after the Russian Moiseev ensemble, were organized by the Communist authorities to create a spectacular national music, presenting a model of discipline and coordination, and hence to co-opt and control the somewhat anarchic field of traditional music and musicians. The orchestras of thirty to sixty players (traditional groups had only three to four musicians, recently five to seven), led by a conductor, were composed of excellent virtuoso instrumentalists (lªutar). Though required to learn musical notation, most did not do so and often managed to preserve a rather beautiful traditional style of playing, especially in the 1950s and 1960s. 

When it began, the Barbu Lªutaru Orchestra — the most famous in the country at the time of this recording — was under the auspices of the Folklore Institute. Tiberiu Alexandru played an important role in choosing its repertoire and style of interpretation. It was entirely supported by the state and was heavily promoted nationally. No survey of folk and popular music in Romania can ignore the folk orchestras of the Communist period or overlook their widespread influence. Thus the present record brightly concludes with a concert piece by the Barbu Lªutaru Orchestra playing with the famous panpipe player Fªnicª Luca, featured here on “Cioc<rlia” (The Lark).",0,0,0,0,0
3345,Sos,NA,"Mythological Uastyrdzhi, protector of men",0,0,0,0,0
577,Perrine était chambreire,Comic Song; Ballad,"Comic ballad, Perrine Was a Servant",0,0,0,0,0
2802,Cradle Song,Lullaby,Crade song performed by a woman 50-52 years old.,0,0,0,0,1
4226,Tambur,NA,Composed by Atoma Agebna,0,0,0,0,0
3409,Drums,Instrumental,Recording of drums,0,0,0,0,0
259,Song Taught by Watusi,Women's Song,"Sounds like Clementine, performed by a female chorus in harmony",0,0,0,0,0
9778,Bu Fei Yu Fong Shon Ge,NA,Song upon returning from fishing,0,0,0,0,0
9039,Chorin Do,Anthem; Song About Leadership; Ceremonial Song,"Chorr, a choral form, anthem sung during a ceremony to Genghis Khan",0,0,0,0,0
3525,Moravian Song 6,NA,NA,0,0,0,0,0
9719,Song accompanied by Suga hanu 6,NA,"In Kamberam, rec. P'tana",0,0,0,0,0
714,"Song of Moses and Miriam, Exodus XV:1",NA,"Song of Moses and Miriam, rejoicing and praising God after successfully crossing the Red Sea and escaping Pharoah's army and enslavement",1,0,0,0,0
307,Libela,Dance Song,"Shonongo dance song, title translates to ""We Are Going to Dance""",0,1,0,0,0
3072,Brave Inspiring Song,NA,NA,0,0,0,0,0
30664,Ayta Song 12,Interlock,Sounds like mixed group of soloists interlocking very loosely and slowly (VG),0,0,0,0,0
4051,Chant from the Divine Office,NA,"Chant in Syriac from the Divine Office, morning or evening prayers of the monks",1,0,0,0,0
9323,Gitalimale,Self-Delectative Song,Self-delectative,0,0,0,0,0
2096,Izibongo Zika Ndlunkulu,Praise Song; Chant,"Praise song and chant, Praises of the Chief's Wife",0,0,0,0,0
9431,Alla Carpinese,Love Song,"Love song in the style of Carpino (Puglie). The lyrics translate to ""Take the shovel and go for fire/Go to the house of your sweetheart and enjoy two hours of pleasure.""",0,0,0,0,0
672,Romance De Pernales,Ballad - Romance,"Nineteenth century ballad about  Andalusian bandit Francisco Ríos González ""El Pernales"" Pernales (1879-1907), sometimes mythologized as the Spanish Robin Hood. Sung by a shepherd in his summer hut (choza)",0,0,0,0,0
3638,Alus,NA,"The hala Alus dreamed this song when he and his group were felling trees and making a clearing for cultivation, round style entries",0,0,0,0,0
2835,Shepherdess's Call,Shepherd's Song; Calls; Yodel; Pastoral Song,Yodeling melody,0,0,0,0,0
9293,Song of the Nightingale,Animal Song,Female singer with flute,0,0,0,0,0
30508,Ifugao Song 22,NA,"Male group, some stomping or chopping, much secundal dissonance",0,0,0,0,0
30654,Talivunvun,NA,"Duet, organization unable to be identified",0,0,0,0,0
685,Akiba Chacarera,Chacarera; Dance Song; Flamenco,"Chacarera, strophic song with hints of flamenco guitar style, lyrics describing the importance of the chacarera to Argentina",0,1,0,0,0
2132,Yuchi Song,Men's Song,Male choral performance,0,0,0,0,0
849,Gond Folk Song,NA,Strophic folk song,0,0,0,0,0
1495,Recreational Song for Festival 2,Recreational Dance; Dance Song; Festival Song,"Recreational, non-ceremonial song sung at Festival, August 1955. Historically, the Baoule people do not have tribal festival, however, in 1954 the Superior Chief decided to initiate a festival. This celebration takes place for three days during the month of August, and some of the best musicians are invited to perform in the chief's village of Sakassou. The festival does not have any ceremonial Significance and is given only for the recreation of the people involved, and to provide additional incentive to Baoule musicians to perfect their artistry. During the first two days of the festival independent groups perform the music and dance in which they are most skilled. However, on the last day capsule performances before the assembled chiefs and elders in a chain of competitive performances. (Donald Thurow, The Baoule of the Ivory Coast, Ethnic Folkways Library, Album No. FE 4476, 1956)",0,1,0,0,0
